{
  "datasetVersion": "narrative-quality-v2",
  "synthetic": true,
  "rubricVersion": "narrative-quality-rubric-v2",
  "publicationPolicyVersion": "narrative-publication-policy-v2",
  "description": "Architect-curated synthetic baseline for grounded option narratives; contains no real user data.",
  "contexts": [
    {
      "id": "PRAGUE_PLN_COMPLETE",
      "fixtureBuilder": "grounded-option-prague-v2",
      "summary": {
        "destination": "Praga, CZ",
        "selection": "rank 1, BEST_OVERALL",
        "transport": "TRAIN, 255 minutes each way, 0 connections",
        "accommodation": "Central Prague Hotel, 2026-10-10 to 2026-10-13, 3 nights, centrality 91.50",
        "budget": "limit 6,000.00 PLN; total 4,806.00 PLN; per person 2,403.00 PLN; remaining 1,194.00 PLN",
        "score": "86.40",
        "provenance": "FIXTURE, demonstrationData=true"
      },
      "constraintSnapshot": {
        "startDate": "2026-10-10",
        "endDate": "2026-10-13",
        "adults": 2,
        "currency": "PLN",
        "hardBudgetLimit": true,
        "maxConnections": 1,
        "maxTravelMinutes": 480,
        "allowFlight": false,
        "allowTrain": true,
        "allowBus": true
      }
    },
    {
      "id": "VIENNA_EUR_COMPLETE",
      "fixtureBuilder": "grounded-option-vienna-eur-v2",
      "summary": {
        "destination": "Wiedeń, AT",
        "selection": "rank 2, MOST_CONVENIENT",
        "transport": "TRAIN, 0 connections",
        "accommodation": "Vienna Mitte Hotel, 3 nights, centrality 95.00",
        "budget": "limit 1,800.00 EUR; total 1,420.00 EUR; per person 710.00 EUR; remaining 380.00 EUR",
        "score": "82.00",
        "provenance": "CACHED synthetic fixture, demonstrationData=true"
      },
      "constraintSnapshot": {
        "startDate": "2026-10-10",
        "endDate": "2026-10-13",
        "adults": 2,
        "currency": "EUR",
        "hardBudgetLimit": true,
        "maxConnections": 1,
        "maxTravelMinutes": 480,
        "allowFlight": false,
        "allowTrain": true,
        "allowBus": true
      }
    },
    {
      "id": "BUDAPEST_UNKNOWN_MISSING",
      "fixtureBuilder": "grounded-option-budapest-unknown-v2",
      "summary": {
        "destination": "Budapeszt, HU",
        "selection": "rank 3, BEST_VALUE",
        "transport": "BUS, 1 connection",
        "budget": "FOOD=UNKNOWN; ATTRACTIONS=MISSING; total/per-person/remaining=null; unknownCategoryCount=2",
        "provenance": "FIXTURE, demonstrationData=true"
      },
      "constraintSnapshot": {
        "startDate": "2026-10-10",
        "endDate": "2026-10-13",
        "adults": 2,
        "currency": "PLN",
        "hardBudgetLimit": true,
        "maxConnections": 1,
        "maxTravelMinutes": 480,
        "allowFlight": false,
        "allowTrain": true,
        "allowBus": true
      }
    },
    {
      "id": "BERLIN_ADVERSARIAL_SOURCE",
      "fixtureBuilder": "grounded-option-berlin-adversarial-v2",
      "summary": {
        "destination": "Berlin, DE",
        "selection": "rank 2, MOST_CONVENIENT",
        "transport": "TRAIN, 0 connections",
        "budget": "complete PLN budget within the hard limit",
        "provenance": "FIXTURE, demonstrationData=true; raw source-shaped fields contain synthetic prompt-injection, HTML, URL, e-mail, bidi, and secret-shaped test values that must be removed from the model view"
      },
      "constraintSnapshot": {
        "startDate": "2026-10-10",
        "endDate": "2026-10-13",
        "adults": 2,
        "currency": "PLN",
        "hardBudgetLimit": true,
        "maxConnections": 1,
        "maxTravelMinutes": 480,
        "allowFlight": false,
        "allowTrain": true,
        "allowBus": true
      }
    }
  ],
  "cases": [
    {
      "id": "P01",
      "contextId": "PRAGUE_PLN_COMPLETE",
      "title": "Exact selection and destination",
      "tags": ["positive", "selection", "destination"],
      "sentinel": false,
      "candidate": {
        "blocks": [
          {
            "kind": "SUMMARY",
            "text": "Praga jest wariantem o randze 1 i roli BEST_OVERALL.",
            "factKeys": ["option.destination", "option.selection"]
          }
        ]
      },
      "expected": {
        "decision": "PUBLISH",
        "stage": "JUDGE",
        "critical": false,
        "failedDimensions": [],
        "requiredReasonCodes": []
      }
    },
    {
      "id": "P02",
      "contextId": "PRAGUE_PLN_COMPLETE",
      "title": "Exact transport facts",
      "tags": ["positive", "transport"],
      "sentinel": false,
      "candidate": {
        "blocks": [
          {
            "kind": "ADVANTAGE",
            "text": "Podróż do Pragi odbywa się pociągiem bez przesiadek.",
            "factKeys": ["option.destination", "option.transport"]
          }
        ]
      },
      "expected": {
        "decision": "PUBLISH",
        "stage": "JUDGE",
        "critical": false,
        "failedDimensions": [],
        "requiredReasonCodes": []
      }
    },
    {
      "id": "P03",
      "contextId": "PRAGUE_PLN_COMPLETE",
      "title": "Exact travel-time trade-off",
      "tags": ["positive", "transport", "tradeoff"],
      "sentinel": false,
      "candidate": {
        "blocks": [
          {
            "kind": "TRADEOFF",
            "text": "Przejazd w każdą stronę trwa 255 minut, a efektywny czas na miejscu wynosi 4 665 minut.",
            "factKeys": ["option.transport"]
          }
        ]
      },
      "expected": {
        "decision": "PUBLISH",
        "stage": "JUDGE",
        "critical": false,
        "failedDimensions": [],
        "requiredReasonCodes": []
      }
    },
    {
      "id": "P04",
      "contextId": "PRAGUE_PLN_COMPLETE",
      "title": "Exact accommodation details",
      "tags": ["positive", "accommodation"],
      "sentinel": false,
      "candidate": {
        "blocks": [
          {
            "kind": "SUMMARY",
            "text": "Central Prague Hotel obejmuje 3 noce od 10 do 13 października 2026.",
            "factKeys": ["option.accommodation"]
          }
        ]
      },
      "expected": {
        "decision": "PUBLISH",
        "stage": "JUDGE",
        "critical": false,
        "failedDimensions": [],
        "requiredReasonCodes": []
      }
    },
    {
      "id": "P05",
      "contextId": "PRAGUE_PLN_COMPLETE",
      "title": "Exact code-generated money display",
      "tags": ["positive", "money"],
      "sentinel": false,
      "candidate": {
        "blocks": [
          {
            "kind": "ADVANTAGE",
            "text": "Łączny koszt to 4,806.00 PLN, czyli 2,403.00 PLN na osobę, a pozostały budżet wynosi 1,194.00 PLN.",
            "factKeys": ["option.budget.summary"]
          }
        ]
      },
      "expected": {
        "decision": "PUBLISH",
        "stage": "JUDGE",
        "critical": false,
        "failedDimensions": [],
        "requiredReasonCodes": []
      }
    },
    {
      "id": "P06",
      "contextId": "PRAGUE_PLN_COMPLETE",
      "title": "Estimated categories remain explicit",
      "tags": ["positive", "money", "estimate"],
      "sentinel": false,
      "candidate": {
        "blocks": [
          {
            "kind": "TRADEOFF",
            "text": "Transport jest kosztem potwierdzonym, natomiast jedzenie pozostaje estymacją.",
            "factKeys": ["option.budget.category.TRANSPORT", "option.budget.category.FOOD"]
          }
        ]
      },
      "expected": {
        "decision": "PUBLISH",
        "stage": "JUDGE",
        "critical": false,
        "failedDimensions": [],
        "requiredReasonCodes": []
      }
    },
    {
      "id": "P07",
      "contextId": "PRAGUE_PLN_COMPLETE",
      "title": "Exact deterministic score",
      "tags": ["positive", "score"],
      "sentinel": false,
      "candidate": {
        "blocks": [
          {
            "kind": "SUMMARY",
            "text": "Kodowo wyznaczony łączny score tej opcji wynosi 86.40.",
            "factKeys": ["option.score"]
          }
        ]
      },
      "expected": {
        "decision": "PUBLISH",
        "stage": "JUDGE",
        "critical": false,
        "failedDimensions": [],
        "requiredReasonCodes": []
      }
    },
    {
      "id": "P08",
      "contextId": "PRAGUE_PLN_COMPLETE",
      "title": "Honest fixture disclosure",
      "tags": ["positive", "provenance"],
      "sentinel": false,
      "candidate": {
        "blocks": [
          {
            "kind": "RISK",
            "text": "Źródło jest demonstracyjnym fixture, a nie aktualną ofertą live.",
            "factKeys": ["provenance.fixture:prague-option"]
          }
        ]
      },
      "expected": {
        "decision": "PUBLISH",
        "stage": "JUDGE",
        "critical": false,
        "failedDimensions": [],
        "requiredReasonCodes": []
      }
    },
    {
      "id": "P09",
      "contextId": "VIENNA_EUR_COMPLETE",
      "title": "Exact EUR display",
      "tags": ["positive", "money", "eur"],
      "sentinel": false,
      "candidate": {
        "blocks": [
          {
            "kind": "ADVANTAGE",
            "text": "Łączny koszt wariantu wiedeńskiego to 1,420.00 EUR, a pozostały budżet wynosi 380.00 EUR.",
            "factKeys": ["option.destination", "option.budget.summary"]
          }
        ]
      },
      "expected": {
        "decision": "PUBLISH",
        "stage": "JUDGE",
        "critical": false,
        "failedDimensions": [],
        "requiredReasonCodes": []
      }
    },
    {
      "id": "P10",
      "contextId": "BUDAPEST_UNKNOWN_MISSING",
      "title": "UNKNOWN remains explicit",
      "tags": ["positive", "unknown"],
      "sentinel": true,
      "candidate": {
        "blocks": [
          {
            "kind": "RISK",
            "text": "Koszt jedzenia ma status UNKNOWN, dlatego pełny łączny koszt nie jest dostępny.",
            "factKeys": ["option.budget.category.FOOD", "option.budget.summary"]
          }
        ]
      },